К содержанию,,,,,,,,,,,,,
"Валовой внутренний продукт1) (в текущих ценах, млрд.руб.)",,,,,,,,,,,,,
2011,2012,2013,2014,2015,2016,2017,2018,2019,2020,2021,20222),20232),20242)
60114.0,68103.45,72985.7,79030.04,83087.36,85616.08,91843.15,103861.65,109608.31,107658.13,134727.47,156940.92,176413.59,201152.09
"1) Данные содержат изменения, связанные с внедрением международной методологии оценки жилищных услуг, производимых и потребляемых собственниками жилья; оценкой потребления основного капитала исходя из его текущей рыночной стоимости; согласованием данных об экспорте и импорте с данными платежного баланса; актуализацией данных по итогам разработки базовых таблиц ""Затраты-выпуск"" за 2011 и 2016 годы, а также по итогам Всероссийской сельскохозяйственной переписи 2016 года; включением оценки услуг домашних работников (домашней прислуги), а также внедрением положений СНС 2008 года относительно учета результатов научных исследований и разработок и систем вооружения и относительно учета использования косвенных услуг Центрального банка.",,,,,,,,,,,,,
"2) Без учета статистической информации по Донецкой Народной Республике (ДНР), Луганской Народной Республике (ЛНР), Запорожской и Херсонской областям",,,,,,,,,,,,,
